{
  "id": "reasoning",
  "system": "diagram-core-v1",
  "asset_revision": 1,
  "viewBox": "0 0 96 96",
  "category": "ai-models",
  "semantic_kind": "reasoning",
  "structural_prototype": "branching-reasoning-path",
  "parts": ["body", "shell", "premise", "path", "branch", "result", "indicator"],
  "attachments": {
    "receive": {"x": 8, "y": 52},
    "send": {"x": 88, "y": 35},
    "status": {"x": 68, "y": 65}
  },
  "states": [],
  "actions": ["receive", "decompose", "decide", "send"],
  "status": "approved"
}
