{
  "id": "memory",
  "system": "diagram-core-v1",
  "asset_revision": 1,
  "viewBox": "0 0 96 96",
  "category": "ai-models",
  "semantic_kind": "memory",
  "structural_prototype": "stacked-memory",
  "parts": ["body", "shell", "drawer-top", "drawer-bottom", "card", "indicator"],
  "attachments": {
    "receive": {"x": 8, "y": 42},
    "send": {"x": 88, "y": 62},
    "status": {"x": 48, "y": 64}
  },
  "states": [],
  "actions": ["receive", "write", "recall", "send"],
  "status": "visual-review"
}
