{
  "id": "git-repository",
  "system": "diagram-core-v1",
  "asset_revision": 1,
  "viewBox": "0 0 96 96",
  "category": "development-delivery",
  "semantic_kind": "git-repository",
  "structural_prototype": "versioned-repository-box",
  "parts": ["body", "box", "branch-tree", "commit", "history", "indicator"],
  "attachments": {
    "receive": {"x": 9, "y": 48},
    "send": {"x": 87, "y": 48},
    "status": {"x": 71, "y": 70}
  },
  "states": [],
  "actions": ["receive", "commit", "store", "send"],
  "status": "approved"
}
