{
  "id": "assistant",
  "system": "diagram-core-v1",
  "asset_revision": 1,
  "viewBox": "0 0 96 96",
  "category": "actors",
  "semantic_kind": "assistant",
  "structural_prototype": "service-assistant-bubble",
  "parts": ["body", "shell", "service-core", "reply-tail", "sparkle", "indicator"],
  "attachments": {
    "receive": {"x": 8, "y": 48},
    "send": {"x": 88, "y": 48},
    "status": {"x": 25, "y": 48}
  },
  "states": [],
  "actions": ["receive", "assist", "respond", "send"],
  "status": "visual-review"
}
