{
  "id": "load-balancer",
  "system": "diagram-core-v1",
  "asset_revision": 1,
  "viewBox": "0 0 96 96",
  "category": "network-interfaces",
  "semantic_kind": "load-balancer",
  "structural_prototype": "three-way-load-distributor",
  "parts": ["body", "distributor", "input", "outlet-top", "outlet-middle", "outlet-bottom", "indicator"],
  "attachments": {
    "receive": {"x": 10, "y": 48},
    "send": {"x": 86, "y": 48},
    "status": {"x": 43, "y": 48}
  },
  "states": [],
  "actions": ["receive", "balance", "distribute", "send"],
  "status": "visual-review"
}
