{
  "id": "cloud",
  "system": "diagram-core-v1",
  "asset_revision": 1,
  "viewBox": "0 0 96 96",
  "category": "compute-runtime",
  "semantic_kind": "cloud",
  "structural_prototype": "modular-cloud-runtime",
  "parts": ["body", "cloud-shell", "module-left", "module-center", "module-right", "signal", "indicator"],
  "attachments": {
    "receive": {"x": 10, "y": 54},
    "send": {"x": 86, "y": 54},
    "status": {"x": 48, "y": 22}
  },
  "states": [],
  "actions": ["receive", "sync", "process", "send"],
  "status": "approved"
}
