{
  "id": "tool",
  "system": "diagram-core-v1",
  "asset_revision": 1,
  "viewBox": "0 0 96 96",
  "category": "ai-models",
  "semantic_kind": "tool",
  "structural_prototype": "pipeline-tool",
  "parts": ["body", "shell", "handle", "mechanism", "core", "indicator"],
  "attachments": {
    "receive": {"x": 8, "y": 48},
    "send": {"x": 88, "y": 48},
    "status": {"x": 48, "y": 52}
  },
  "states": [],
  "actions": ["receive", "activate", "process", "send"],
  "status": "visual-review"
}
