{
  "id": "webhook",
  "system": "diagram-core-v1",
  "asset_revision": 1,
  "viewBox": "0 0 96 96",
  "category": "network-interfaces",
  "semantic_kind": "webhook",
  "structural_prototype": "event-webhook-trigger",
  "parts": ["body", "shell", "trigger", "event-dot", "pulse", "indicator"],
  "attachments": {
    "receive": {"x": 12, "y": 48},
    "send": {"x": 84, "y": 48},
    "status": {"x": 24, "y": 28}
  },
  "states": [],
  "actions": ["receive", "trigger", "notify", "send"],
  "status": "visual-review"
}
