{
  "id": "alert",
  "system": "diagram-core-v1",
  "asset_revision": 1,
  "viewBox": "0 0 96 96",
  "category": "operations-observability",
  "semantic_kind": "alert",
  "structural_prototype": "signal-alert-beacon",
  "parts": ["body", "shell", "light", "wave", "core", "indicator"],
  "attachments": {
    "receive": {"x": 9, "y": 48},
    "send": {"x": 87, "y": 48},
    "status": {"x": 72, "y": 70}
  },
  "states": [],
  "actions": ["receive", "detect", "notify", "send"],
  "status": "approved"
}
