{
  "id": "llm",
  "system": "diagram-core-v1",
  "asset_revision": 1,
  "viewBox": "0 0 96 96",
  "category": "ai-models",
  "semantic_kind": "llm",
  "structural_prototype": "language-context-stack",
  "parts": ["body", "shell", "token-row", "context-band", "attention-path", "indicator"],
  "attachments": {
    "receive": {"x": 8, "y": 48},
    "send": {"x": 88, "y": 48},
    "status": {"x": 72, "y": 72}
  },
  "states": [],
  "actions": ["receive", "attend", "generate", "send"],
  "status": "approved"
}
