{
  "id": "pdf",
  "system": "diagram-core-v1",
  "asset_revision": 1,
  "viewBox": "0 0 96 96",
  "category": "files-content",
  "semantic_kind": "pdf",
  "structural_prototype": "paginated-pdf-file",
  "parts": ["body", "page", "fold", "pages", "spine", "badge", "indicator"],
  "attachments": {
    "receive": {"x": 12, "y": 48},
    "send": {"x": 84, "y": 48},
    "status": {"x": 66, "y": 70}
  },
  "states": [],
  "actions": ["receive", "open", "page", "send"],
  "status": "approved"
}
