{
  "id": "ci-cd",
  "system": "diagram-core-v1",
  "asset_revision": 1,
  "viewBox": "0 0 96 96",
  "category": "development-delivery",
  "semantic_kind": "ci-cd",
  "structural_prototype": "three-stage-delivery-pipeline",
  "parts": ["body", "shell", "build", "test", "deploy", "progress", "indicator"],
  "attachments": {
    "receive": {"x": 9, "y": 48},
    "deploy": {"x": 87, "y": 48},
    "status": {"x": 72, "y": 70}
  },
  "states": [],
  "actions": ["receive", "build", "test", "deploy"],
  "status": "visual-review"
}
